,Terpopuler
0,Respons Dhea Ananda Saat Tahu Leony Memilih Childfree
1,"Puja-puji IKN, AHY Dinilai Rela Tinggalkan Pendukung"
2,"Percakapan Rahasia Jerman-Ukraina Bocor, Ungkap Rencana Bombardir Crimea"
3,"Usia Bertambah, Leony Tak Menyesal Pernah Memutuskan Childfree"
4,"Jadi Inspirasi Ariel Nidji Saat Ciptakan Lagu Hapus Aku, Dhea Ananda: Habis Itu Aku yang Ngejar"
5,"Suara PSI Melonjak, Anies Singgung Ketuanya Anak Presiden"
6,"Main ke Pasar Santa, Ed Sheeran Beli Vinyl White Shoes & The Couples Company Seharga Rp 1,5 Juta"
7,"Bandara Sepinggan-IKN Bakal Tersambung Tol, Ini Progresnya"
8,"Suara PSI Naik Pesat, Pengamat: Tak Mungkin Simsalabim Langsung Melonjak"
9,"Link Live Streaming RANS Vs Persib Bandung, Kickoff Pukul 19.00 WIB"
10,"Unggul Real Count, Prabowo: Jangan Euforia, tapi Dibuat Merenung"
11,Khofifah: Insyaallah Prabowo-Gibran Dilantik Oktober
12,"Shoebill, Burung Sebesar Manusia yang Memangsa Bayi Buaya"
13,"""Ngaku"" Takut Dimarahi Orangtua, Pengunjung ""Jakarta Toys and Comics Fair 2024"" Tetap Rogoh Jutaan Rupiah demi Gundam"
14,"Mulut Mayat Indriana Dipakaikan Masker Seolah Tertidur, 3 Hari Dibawa Naik Mobil"
15,Benarkah Madu Efektif Sembuhkan Sakit Tenggorokan?
16,"Suara PSI Meroket, Koalisi Masyarakat Sipil Duga Ada Penggelembungan"
17,"Cara Melacak Nomor HP Tanpa Aplikasi, Mudah dan Praktis"
18,Nasib Minimarket di Kawasan Ponpes Daarut Tauhid Usai Video Protes Aa Gym Viral
19,"Kronologi Pembunuhan Indriana, Dihabisi di Bogor, Jasadnya 3 Hari Dibawa Jakarta-Banjar"
20,Mobil Niaga Sebaiknya Pakai Transmisi Manual
21,"Kebakaran Hutan di Texas Meluas Hingga 1 Juta Hektar, Terbesar dalam Sejarah"
22,"Ada Diskon PPN, 350 Unit Rumah di Karawang ""Sold Out"""
23,"Akusisi Siantar City Square, Citra Swarna Perkuat Bisnis Hospitalitas"
24,"Saat Gajah Sumatera ""Terjepit"" Kebun Sawit..."
25,Jadwal Libur Sekolah Bulan Maret 2024 bagi Siswa SD-SMA
26,Romahurmuziy Ungkap 2 Modus untuk Loloskan PSI ke Parlemen
27,"Beda Tafsir soal Putusan MK, Ambang Batas Parlemen Perlu Diperkecil atau Diperbesar?"
28,"Jimly Asshiddiqie: Sulit Buktikan Kecurangan Terstruktur, Sistematis, dan Masif di Pilpres"
29,"Melihat Program Makan Siang Gratis di India, Anggaran, Skema, dan Dampaknya"
30,Jadwal Libur Awal Puasa Ramadhan 2024 untuk Siswa di Pulau Jawa
31,"Di KRI Alugoro-405, KSAL Sematkan Brevet Hiu Kencana ke Panglima TNI, KSAD, dan 5 Perwira Tinggi"
32,"9 Orang Terlibat Perampokan Truk Bermuatan Rokok di Madiun, Satu Pelaku Mengaku Polisi"
33,"Beredar 4 Nama Calon Menkeu yang Diincar Prabowo, Erick Thohir: Semuanya Bagus"
34,"Kontrakan Korban Pembunuhan di Bukit Pelangi Bogor Sepi, Lampu Masih Menyala"
35,Luhut Pandjaitan Tertawa Terbahak-bahak Nonton Film Agak Laen
36,"Suara PSI Melonjak, Anies: Kalau Memang Tidak Ada, Jangan Diada-adakan"
37,Gus Miftah Kisahkan Awal Mula Dedi Mulyadi Gabung ke Prabowo hingga Jadi Caleg Gerindra Suara Tertinggi
38,Peselancar Indonesia Rio Waida Lolos ke Olimpiade Paris 2024
39,Apa Itu Love Scam? Begini Ciri-ciri Penipuan Berkedok Percintaan yang Perlu Diwaspadai
40,"Ikuti Google Maps, Turis Ini Malah Nyasar ke Sungai Penuh Buaya"
41,"Berawal Dapat Pesan di Grup Instagram, Guru di Kupang Tertipu Investasi Bodong Rp 80 Juta"
42,"Gara-gara Ngantuk Mobil Pajero Terjungkal, Aiptu Hardi Tewas"
43,"Prediksi RANS Vs Persib, Rotasi Tim Sultan, Maung Full Team"
44,"Daftar Top Skor MLS, Lionel Messi Bersaing Ketat dengan Benteke"
45,Update Harga Motor Bebek Bekas di Bawah Rp 10 Jutaan
46,Reaksi Ancelotti soal Insiden Bellingham Saat Lawan Valencia
47,"Transformasi Serigala Ibu Kota, Roma Jadi Mesin Gol di Bawah De Rossi"
48,"Di Luar Dugaan Ilmuwan, Orca Bisa Memangsa Hiu Putih Besar Hanya Kurang dari 2 Menit"
49,6 Tanda Ada yang Tidak Beres dalam Foto Bersama Pasangan
50,Siaran Langsung dan Link Live Streaming Man City Vs Man United
51,"Jika Tuntutannya Tak Direspons DPR, Relawan AMIN Ancam Akan Demo Lagi 5 Maret 2024"
52,"Razia di Pekanbaru, 47 Sepeda Motor ""Diangkut"" Polisi"
53,"5 Alasan Siswa Membolos Sekolah, Hasil Riset Dosen UM Sidoarjo"
54,"Regulasi Pemain U23 Dihapus, Pelatih Borneo FC Beri Jawaban Diplomatis"
55,"Messi Bahagia Suarez Bersinar, Tekad La Pulga Bawa Inter Miami Juara"
56,"Terima Donasi Rp 15 Triliun, Kampus Kedokteran di AS Langsung Gratiskan Biaya Kuliah"
57,"Hasil Persebaya Vs PSS: Gol Kilat Iqbal dan Panenka Bruno, Bajul Ijo Berjaya"
58,Arti Posisi Tidur Terhadap Hubunganmu dengan Pasangan
59,Kopaska Pastikan Adaptif terhadap Peperangan Modern
60,"Mulai April 2024 Garuda Tambah Jadwal Terbang di 16 Kota Ini, Ada Yogyakarta, Padang, Lombok"
61,5 Pekerjaan IT yang Terancam Digantikan oleh AI 
62,Realme 12 Plus: Spesifikasi dan Harga di Indonesia
63,"Awas Melanggar, Mulai Besok Polisi Gelar Razia Lalu Lintas"
64,10 Jurusan Sedikit Peminat Universitas Brawijaya di UTBK SNBT
65,"Beda Sikap AHY soal IKN: Dulu Kritik, Sekarang Memuji"
66,"Seperti Coldplay, Ed Sheeran Juga Dapat Visa Khusus dari Imigrasi"
67,"Fresh Graduate Singapura Dapat Gaji Tinggi, Ini Besarannya"
68,6 Penyebab Napas Ngos-ngosan dan Mudah Lelah Saat Naik Tangga
69,"Kereta Api Tabrak Mobil di Sunggal, 2 Orang Tewas"
70,"Profil Kurnia Meiga, Mantan Kiper Timnas yang Jualan Emping di TikTok"
71,Cara Mengatasi Kebosanan dalam Hubungan Cinta
72,"Kronologi Pembunuhan Perempuan Asal Jakarta, Mayatnya Dibungkus Selimut dan Dibuang di Banjar"
73,Cara Cek Umur Kartu Telkomsel lewat Kode UMB *999#
74,"Dibunuh di Bogor, Jasad Perempuan Terbungkus Selimut Dibawa ke Jakarta lalu Dibuang di Banjar"
75,"BTN Luncurkan Logo Baru yang Lebih ""Segar"", Ini Maknanya"
76,"Persebaya Vs PSS, Munster Janjikan Bajul Ijo Tampil Garang"
77,Ditjen HAM Sebut Rencana KUA Melayani Semua Agama Perlu Kajian
78,5 Tips Menghidupkan Kembali Tanaman yang Mati
79,Viral Pria Menari di Jalanan Setelah Resign dari Kerja Kantoran
80,"5 Program Mudik Gratis 2024 dari Pemprov, DJKA, dan Kemenhub"
81,"Perempuan Ini Minum Soda Setiap Hari Selama Setahun, Lihat Apa yang Terjadi pada Giginya"
82,Pembuat Sertifikat Habib Palsu di Kalideres Pasang Tarif Rp 4 Juta Per Nama
83,"Anggota KPPS di Pati Alami Gangguan Jiwa, Diduga karena Beratnya Beban Kerja"
84,"Cuan Puluhan Juta Rupiah dalam Sehari di Festival ""Jakarta Toys and Comics Fair 2024"""
85,"Permintaan Pasar Furnitur Ramah Lingkungan Tembus 44,2 Miliar Dolar AS"
86,Reaksi Pochettino Usai Teriakan Mourinho-Abramovich Menggema di Stamford Bridge
87,PSIS Semarang Kehilangan Dua Pemain Asing sampai Akhir Musim
88,"Tewas Selang 26 Hari, Bocah Jadi Korban ke-16 Anjing Rabies di TTS"
89,"Harga dan Cara Beli Tiket Konser IU di Indonesia, Dibuka 8 Maret 2024"
90,"Mudik Gratis Warga ber-KTP Jateng, Pendaftaran Dibuka 6 Maret"
91,Seberapa Sering Anda Harus Mengecat Dinding Interior Rumah?
92,Anies: Saya Senang Sekali Bisa Kembali ke Kampung Akuarium...
93,Dua Kementerian Perlu Dilibatkan Susun SKB Pembatasan Angkutan Logistik Saat Hari Besar Keagamaan
94,"Jelang MotoGP 2024, Marquez Pamer Lengan Bekas Operasi"
95,Penggemar Bujuk Penjual Kaset di Pasar Santa Jual Vinyl dari Ed Sheeran
96,"Pemakaman Musuh Bebuyutan Putin, Momentum Baru Perlawanan Rakyat Rusia"
97,Main ke Toko Vinyl di Pasar Santa yang Dikunjungi Ed Sheeran Sebelum Konser di JIS
98,Benarkah Olahraga Saat Kurang Tidur Bisa Menyebabkan Stroke?
99,"Ikut Misi Riset Rusia, Gerry Utama Jadi Ilmuwan Termuda Indonesia ke Antarktika"
100,10 Cara Mengatasi Speaker HP Mati dengan Mudah dan Praktis
101,"""Sustainability"" Jadi Perhatian Pelaku Usaha Furnitur Indonesia"
102,"Cerita Perjuangan Promosi Konser Zaman Dulu, Adrie Subono: Gue Sebarin Flyer"
103,"Jangan Bunuh Kutu Kucing dengan Dipencet, Ini Risikonya"
104,"Ed Sheeran Bagi-bagi Vinyl di Pasar Santa, Banyak Pengunjung dan Pedagang Syok"
105,Syarat dan Cara Ajukan KUR BRI
106,Revaluasi Orde Reformasi
107,"Bangkai Kucing Bawa Petaka, 2 Pria di Bogor Tewas Saat Kuras Sumur"
108,"Pupuk Cair Vs Pupuk Butiran, Mana yang Lebih Baik?"
109,"Enggan Komentari Lonjakan Suara PSI, KPU: Hasil Resminya Nanti"
110,"Diskon 13 Makanan Minuman Awal Maret 2024, Apa Saja?"
111,Jadwal KRL Jogja-Solo Maret 2024 dari Stasiun Tugu Yogyakarta dan Lempuyangan
112,"Dukung Pacar, Lee Jong Suk Tampak Hadir di Konser IU"
113,"BUMN Surveyor Indonesia Buka Lowongan Kerja, Simak Posisi dan Syaratnya"
114,"Tecno Umumkan Camon 30 Premier, HP Android dengan Teknologi Kamera PolarAce Imaging System"
115,"Berlangsung Sukses, Rapim TNI-Polri 2024 Tegaskan Sinergi untuk Jaga Keamanan Negara"
116,Ed Sheeran Diklaim Jadi Penyanyi Pertama yang Datang ke Pasar Santa Bagi-bagi Album Vinyl
117,"Cara Lapor SPT Tahunan Online via E-Filing, Terakhir hingga 31 Maret 2024"
118,"""Jakarta Toys and Comics Fair 2024"" Bukan Cuma Urusan Mainan"
119,"Ketahui 2 Jalur Pendaftaran Polteknaker 2024, Bisa Kuliah Gratis"
120,"Mobil Elf Terguling di Jalur Sarangan-Cemorosewu, 8 Orang Dibawa ke RS"
121,5 Manfaat Daun Salam yang Jarang Diketahui 
122,Menteri PUPR Basuki Minta BTN Turunkan Bunga KPR Nonsubsidi
123,"Menurut Studi, Segini Konsumsi Kopi untuk Menurunkan Berat Badan"
124,Vinyl Gratis dari Ed Sheeran untuk Penggemar Langsung Ludes dalam Dua Jam 
125,"Statistik Song Ui Young, Gelandang Potensial yang Putus Kontrak dengan Persebaya"
126,Polisi Tangkap Pemalsu Sertifikat Habib yang Catut Nama Organisasi Rabithah Alawiyah
127,2 Bocah yang Hanyut di Kali Mampang Ditemukan Meninggal Dunia
128,"Harga Beras Naik, Omzet Pedagang di Pasar Rumput Justru Merosot Drastis"
129,Cara Daftar Mudik Gratis Warga ber-KTP Jateng dan Syaratnya
130,"LPDP-BRIN Buka Beasiswa S2-S3 Bidang Nuklir, Simak Cara Daftarnya"
131,"Jajal Mitsubishi Fuso Canter Bus, Jadi Sopir dan Penumpang"
132,"Harga Telur di Pasar Jaksel Naik, Pedagang: Banyak Pelanggan Protes"
133,"Ngebor 7 Sumur Baru, ExxonMobil Tambah Produksi Minyak 42 Juta Barrel "
134,"IIMS 2024 Catat Penjualan 19.200 Unit, 35 Persen Kendaraan Listrik"
135,"Perdana, Ketua Pengcab HDCI Diketuai Seorang Lady Biker"
136,Jimly Asshiddiqie: Hak Angket Ini untuk Memindahkan Kemarahan Publik ke Ruang Sidang
137,"Penghormatan Fan Ajax untuk Legenda Keturunan Indonesia: Om Simon, Terima Kasih..."
138,Seorang Remaja Tewas Tenggelam Saat Bermain Getek di Danau Rawa Badung
139,"Destinasi Luar Negeri Favorit Turis Indonesia Awal 2024, Versi Travel Agent"
140,"""Jakarta Toys and Comics Fair"" Dukung Industri mainan Lokal"
141,"Daftar Harga Skutik Bekas di Bawah Rp 10 Juta, per Maret 2024"
142,Satu Korban Hilang Akibat Perahu Terbalik di Ambon Belum Ditemukan
143,"Jokowi: Jangan Sampai Kasus ""Bullying"" Ditutupi untuk Lindungi Nama Sekolah"
144,"Gedung DPRD Solok Selatan Kebanjiran, Tinggi Air Capai 1 Meter"
145,Kecewanya Reza Tak Dapat Vinyl Ed Sheeran di Pasar Santa
146,Pemuda Tewas Dibacok Saat Tawuran di Mampang Prapatan 
147,"TVS Callisto 125 Meluncur di Jawa Timur, Harga Rp 24 Jutaan"
148,7 Jenis Bra untuk Payudara Kecil Agar Tampak Lebih Bervolume 
149,French Open  2024: Hasil Drawing dan Jadwal Turnamen
150,"BRI Tebar Dividen Rp 48,1 Triliun dari Laba Tahun 2023"
151,"BTN Rilis Logo Baru, Pesan Erick Thohir: Bantu Milenial Punya Rumah"
152,"Mulai dari Songket yang Mendunia hingga Batik Lasem, UMKM Binaan Pertamina Mejeng di Inacraft 2024 "
153,5 Pilihan Marketing Gratis untuk Bisnis selain Media Sosial
154,Saat Shin Tae-yong ke Belgia untuk Pantau Marselino dan Sandy Walsh...
155,"Tebing 10 Meter Longsor di Wonosobo, Jalan Provinsi Macet 2 Km"
156,Sarkem Fest 2024 di Yogya Angkat Tradisi Apeman Jelang Ramadan
157,Tol Trans Sumatera Menuju Infrastruktur Berkelanjutan untuk Semua
158,"Menu Skutik Gambot Bekas, Honda PCX mulai Rp 20 Juta"
159,"Kebutuhan Biomassa untuk Campuran Bahan Bakar PLTU Diprediksi Mencapai 10,2 Juta Ton pada 2025"
160,"Rusty Wyatt Juara F1 Powerboat Danau Toba 2024, Beruntung Dapat Momentum"
161,Seorang Anak di Baubau Coba Bunuh Ayahnya dengan Bom Molotov
162,Zumba Membakar Berapa Kalori? Simak Ulasannya 
163,Cara Mengganti Kunci Pintu Rumah dengan Benar
164,Tiket Pesawat dan Paket Tur Lebaran 2024 Sudah Banyak yang Sold Out
165,Kemendagri Dorong Pembukaan Lowongan bagi Satpol PP Jadi CPNS dan PPPK
166,"Perempuan Ini Turun 45 Kilogram Usai Melahirkan, Berikut 3 Resepnya"
167,Stefano Lilipaly Tak Terusik meski Tampil Kurang Menggigit
168,Anjing Bisa Endus Penyakit Parkinson dengan Akurasi 90 Persen
169,"Bali dan Labuan Bajo Jadi Destinasi Lokal Favorit Orang Indonesia, Versi Travel Agent"
170,UIN Sunan Kalijaga Yogyakarta Buka Pendaftaran Rektor 2024-2028 
171,Apa itu Payroll dan Manfaatnya Bagi UMKM
172,"Tidur Disebut Bisa Turunkan Berat Badan, Simak Tipsnya"
173,Alasan Transmisi Matik Cocok untuk Mobil Perkotaan
174,"Prakiraan Cuaca Bandung Hari Ini Minggu 3 Maret 2024, dan Besok : Siang ini Hujan Ringan"
175,Minyak Sawit Bisa Jadi Energi Gantikan Bahan Bakar Fosil
176,"Cerita Popo Mangun, Lulusan ""Broadcasting"" yang Alih Profesi Jadi Seniman Art Deco"
177,"Cara Kirim Voice Message di iPhone, Mudah Tak Perlu Mengetik "
178,"Diduga Gara-gara Korsleting, 29 Kamar Kos di Denpasar Ludes Terbakar"
179,"Sakit Saat Liburan di Malaysia, Raja Harald V Pulang ke Norwegia"
180,"TKW Banyuwangi Stroke dan Telantar di Malaysia, P4MI Bantu Melacak"
181,3 Relawan Tersengat Tawon saat Evakuasi Sarangnya di Magetan
182,"Manfaat Tempe, Makanan Murah yang Banyak Keunggulan"
183,Jadwal KRL Jogja-Solo Maret 2024 dari Yogyakarta hingga Palur
184,"Hindari, 5 Kebiasaan yang Bisa Merusak Rambut"
185,"Kabar Pelatih Barcelona: Guardiola Sarankan De Zerbi, Hansi Flick Pilihan Laporta"
186,"Keunggulan Cokelat Indonesia dibanding Luar Negeri, Apa Saja?"
187,5 Tren Karpet 2024 yang Membuat Ruangan Lebih Menawan
188,"Awal Tahun, Kunjungan Wisman ke Indonesia Tembus 927.000 Kunjungan"
189,Luffy dan One Piece Masih Menang di Crunchyroll Anime Awards 2024
190,7 Contoh Bank Sentral di Indonesia dan Negara Lain
191,"Banjir Lahar Semeru, 4 Truk Pasir Terjebak di Tengah Sungai Leprak"
192,Isyana Sarasvati Akan Gelar Konser Tunggal Satu Dekade Tahun Ini
193,Ketika Yoona SNSD Cicipi Bika Ambon di Fan Meeting di Jakarta
194,Mengelola Inflasi Menghindari Defisit Gaji
195,"Pohon Trembesi Tumbang, Jalur Utama di Selatan Banyuwangi Tertutup"
196,"Tren Makeup Hybrid, Mempercantik Tampilan dan Kulit Sekaligus "
197,"Jangkau Lebih Banyak Pengguna, PGN Terus Bangun Infastruktur Jargas"
198,"Rusia Terus Serang Ukraina Timur, 5 Orang Luka-luka"
199,"Elnusa Siapkan Belanja Modal Rp 526 Miliar Tahun Ini, untuk Apa Saja?"
200,Bolehkah Pakaian Berbahan Tencel Dicuci dengan Mesin Cuci?
201,Manfaat Penting Desain Produk untuk Bisnis Anda
202,"Sembari Jalankan Misi Sosial, Jane Kurnadi Sukses Bangun Bisnis Kerajinan Kain"
203,"Pencari Rumput Temukan Mayat Mengapung di Sungai Serang, Yogyakarta"
204,Apakah Paus Pernah Menelan Manusia?
205,"Gelar OSMB, UT Taiwan Perkuat Akses Pendidikan Tinggi bagi Pejuang Devisa"
206,"Perhatian Pemerintah terhadap Angkutan Sungai Minim, Ini Usul Pengamat"
207,Jujutsu Kaisen Raih 11 Piala di Crunchyroll Anime Awards 2024
208,Ketika Yoona SNSD Lebih Pilih Belajar Bareng Yuri daripada Debat dengan Tiffany
209,Apa Itu Lipstik Ombre? Simak Tutorialnya 
210,Ukuran Tubuh Paus Jadi Lebih Kecil karena Perubahan Iklim
211,Alasan Kucing Punya Dua Titik Botak di Antara Mata dan Telinga
